{
  "schema_version": "1.0",
  "pack_id": "profile-diagnostic",
  "pack_type": "review_profile",
  "version": "1.0.0",
  "status": "active",
  "application_domain": "human_health_clinical_translational_biomedicine",
  "supported_review_families": [
    "diagnostic",
    "measurement"
  ],
  "specialties": [],
  "capabilities": [
    "profile_routing",
    "authority_lookup"
  ],
  "terminology_releases": [],
  "authority_sources": [
    "references/methodology-source-registry.md",
    "references/appraisal-certainty.md"
  ],
  "dependencies": [
    "biomedical-foundation"
  ],
  "constraints": {
    "may_override_protocol": false,
    "may_override_authority": false,
    "may_override_estimand": false,
    "may_grant_tool_permissions": false,
    "may_promote_model_output_to_gold": false
  },
  "validation": {
    "level": "fixture_tested",
    "evidence": [
      "tests/test_p1_vertical_slices.py"
    ]
  },
  "content_sha256": "dda5a56d16d7a85ffd9acd49e653638dbed8d9f80bb658d05172fd2c7d494cb9"
}
